{
  "site": {
    "seoTitle": "Jazhikho | Game Developer and Technical Designer",
    "brandName": "Jazhikho",
    "heroEyebrow": "Game development portfolio",
    "heroSummary": "I make games, tools, and design experiments centered on procedural generation, technical systems, and reflective play.",
    "heroPanelText": "My work tends to live where systems design, worldbuilding, and thoughtful player experience overlap.",
    "shortBio": "I am a game developer and research-oriented creator focused on game systems, procedural generation, technical design, and reflective play.",
    "aboutParagraphs": [
      "My public work includes playable games, atmospheric prototypes, and developer-facing tools. Across all of it, the common thread is pretty simple: I like building technical systems that support tone, pacing, clarity, and meaning instead of existing just to be complicated.",
      "A lot of what I do sits around procedural worldbuilding, tools development, and systems thinking, with a technical background in C#, Godot, Unity, Python, and UI and UX-aware design. I also like treating research and analytical writing as part of development rather than something that only happens after the fact.",
      "When AI-assisted workflows are part of the process, I approach them intentionally. I care about provenance, clear boundaries, and staying accountable for the final work, so the focus stays on what I am making, why I am making it, and how the tools fit into that."
    ],
    "heroTags": [
      "C#",
      "Godot",
      "Unity",
      "Python",
      "Procedural generation",
      "Technical design"
    ],
    "strengths": [
      "C#",
      "Godot",
      "Unity",
      "Python",
      "Procedural generation",
      "Game systems design",
      "Tools development",
      "Technical design",
      "UI/UX awareness",
      "Research and analytical writing",
      "Ethical AI workflow awareness"
    ],
    "footerNote": ""
  },
  "projects": [
    {
      "slug": "stargen",
      "title": "StarGen",
      "shortPitch": "Procedurally generated galaxy and star-system tooling for automated worldbuilding.",
      "description": "I built StarGen in Godot as a worldbuilding tool for generating galaxies, star systems, and celestial objects with seeded determinism, 3D viewers, and repeatable results.",
      "longDescription": "StarGen is where a lot of my procedural worldbuilding interests come together. It treats generation as a design tool I can return to, inspect, and expand rather than a one-off gimmick.",
      "role": "Solo developer and systems/tool designer",
      "techTools": [
        "Godot",
        "C#",
        "3D viewers",
        "Procedural generation",
        "Automated test coverage"
      ],
      "status": "In development",
      "year": "2026",
      "tags": [
        "Tool",
        "Sci-fi",
        "Worldbuilding",
        "Seeded generation"
      ],
      "image": "./assets/projects/stargen.png",
      "featured": true,
      "links": [
        {
          "label": "Itch.io project page",
          "url": "https://jazhikho.itch.io/stargen"
        }
      ]
    },
    {
      "slug": "project-harvest",
      "title": "Project Harvest",
      "shortPitch": "A first-person psychological horror roguelite about identity, complicity, and how players treat the bodies they control.",
      "description": "I built Project Harvest in Godot as a psychological horror roguelite that uses repetition, atmosphere, and player choice to keep the relationship between player and avatar front and center.",
      "longDescription": "Project Harvest is one of the clearest examples of how I like to approach reflective design. The structure, failures, and tone all work together to ask what responsibility we carry inside a game system.",
      "role": "Solo developer",
      "techTools": [
        "Godot",
        "Blender",
        "3ds Max",
        "Narrative systems",
        "3D environment work"
      ],
      "status": "Released",
      "year": "2026",
      "tags": [
        "Psychological horror",
        "Reflective play",
        "Roguelite",
        "Narrative design"
      ],
      "image": "./assets/projects/project-harvest.png",
      "featured": true,
      "links": [
        {
          "label": "Itch.io project page",
          "url": "https://jazhikho.itch.io/project-harvest"
        }
      ]
    },
    {
      "slug": "relationship-overhead-tool",
      "title": "Relationship Overhead Tool",
      "shortPitch": "A relationship simulation sandbox for testing whether nuanced social systems can remain computationally lightweight.",
      "description": "I made this as a simulation and benchmarking tool for testing whether a nuanced relationship system could stay readable and computationally lightweight at the same time.",
      "longDescription": "This project works as both a systems sandbox and a proof of concept. It is my way of exploring social simulation with more texture than a single relationship meter, without letting the overhead get out of hand.",
      "role": "Solo developer and systems researcher",
      "techTools": [
        "HTML5",
        "Simulation design",
        "Benchmarking",
        "Matrix views",
        "Performance logging"
      ],
      "status": "Released",
      "year": "2026",
      "tags": [
        "Tool",
        "Relationship systems",
        "Simulation",
        "Narrative support"
      ],
      "image": "./assets/projects/relationship-overhead-tool.png",
      "featured": true,
      "links": [
        {
          "label": "Itch.io project page",
          "url": "https://jazhikho.itch.io/relationship-overhead-tool"
        }
      ]
    },
    {
      "slug": "loot-luck-liability",
      "title": "Loot, Luck & Liability",
      "shortPitch": "A browser roguelite about risky runs, cursed treasure, and luck as both mechanic and punchline.",
      "description": "I built this browser roguelite around fast runs, light progression, and a playful tone that still leaves room for solid systems work under the hood.",
      "longDescription": "Loot, Luck & Liability let me lean into humor, quick iteration, and localization while still building a game with clear progression and readable moving parts.",
      "role": "Solo developer",
      "techTools": [
        "React",
        "Vite",
        "Browser delivery",
        "Localization",
        "Mobile support"
      ],
      "status": "Released",
      "year": "2026",
      "tags": [
        "Roguelite",
        "Browser game",
        "Localization",
        "Jam project"
      ],
      "image": "./assets/projects/loot-luck-liability.png",
      "featured": false,
      "links": [
        {
          "label": "Itch.io project page",
          "url": "https://jazhikho.itch.io/loot-luck-liability"
        }
      ]
    },
    {
      "slug": "private-eye-pierce",
      "title": "Private Eye Pierce & The Ink Spill",
      "shortPitch": "A comic-noir point-and-click adventure where grayscale routine gives way to surreal color and mystery.",
      "description": "This collaborative Unity prototype focuses on atmosphere, character, and story-driven puzzle design more than raw difficulty.",
      "longDescription": "What I like most about this project is its tone. It uses environmental storytelling, monochrome contrast, and small surreal details to build a strong identity without overcomplicating the experience.",
      "role": "Co-developer and collaborator",
      "techTools": [
        "Unity",
        "Aseprite",
        "2D narrative adventure design",
        "Mouse-first interaction"
      ],
      "status": "Prototype",
      "year": "2026",
      "tags": [
        "Narrative adventure",
        "Noir",
        "Collaboration",
        "Vertical slice"
      ],
      "image": "./assets/projects/private-eye-pierce.png",
      "featured": false,
      "links": [
        {
          "label": "Itch.io project page",
          "url": "https://jazhikho.itch.io/private-eye-pierce-the-ink-spill"
        }
      ]
    },
    {
      "slug": "warp-engineer",
      "title": "Warp Engineer",
      "shortPitch": "A browser puzzle about stabilizing a warp bubble by tuning harmonics under pressure.",
      "description": "This is a systems-tuning prototype about stabilizing a warp bubble by managing harmonics, coherence, and pressure under changing conditions.",
      "longDescription": "Warp Engineer is a small project, but it lines up with a lot of what I care about: readable feedback, technical framing, and being honest about process and provenance when AI tools are part of the workflow.",
      "role": "Concept direction and public release ownership",
      "techTools": [
        "HTML5",
        "Puzzle systems",
        "Browser prototype",
        "Public AI disclosure"
      ],
      "status": "In development",
      "year": "2025",
      "tags": [
        "Sci-fi",
        "Prototype",
        "Systems tuning",
        "Puzzle"
      ],
      "image": "./assets/projects/warp-engineer.png",
      "featured": false,
      "links": [
        {
          "label": "Itch.io project page",
          "url": "https://jazhikho.itch.io/warp-engineer"
        }
      ]
    },
    {
      "slug": "manual-override",
      "title": "Manual Override",
      "shortPitch": "An unfinished experimental prototype about what happens when trust in AI systems goes too far.",
      "description": "I built this jam prototype around AI risk, misalignment, and what can happen when people hand off too much judgment to automated systems.",
      "longDescription": "Manual Override is rough around the edges by design and circumstance, but it is also a direct expression of one of my recurring interests: how technical systems shape trust, control, and responsibility.",
      "role": "Solo developer",
      "techTools": [
        "GDevelop",
        "HTML5",
        "Experimental prototyping",
        "Mouse-only interaction"
      ],